HITID,index,comment_index,comments,keys,Worker1,Answer1,Worker2,Answer2,Worker3,Answer3,Worker4,Answer4,Worker5,Answer5,Avg,Date
3GVPRXWRPHUM1LTVDYGMNER4AS1I7W,190,51,"Wishing all of you a Happy Thanksgiving Holiday Weekend! Robert  short answer is yes  Sofft works very well with dress shirts in terms of ironing and providing a professional finish. The process we used to obtain the professional finish is detailed below. We washed dress shirts using a liquid detergent, introduced starch in the rinse cycle of a front loading washing machine and then immersed the clean clothes in diluted Sofft for 10 minutes in a 5 gallon pail. The cleaners have programmable washing machines so that they can inject starch and Sofft sequentially into the washing machines.The shirts were then put back in the washer in the spindry cycle, dried and then ironed. After treating the clothes with Sofft, the ironing process is remarkably easier and it is also easier to obtain a more professional quality finish on dress shirts at home. Incidentally, this experiment was done with my friend who had his own dry cleaning shop for over 20 years. He was so impressed that he signed on to recruit his dry cleaner colleagues to offer Sofft treated shirts to their clients. When we do our laundry at home, there is not a straightforward way to introduce both starch and Sofft into the washing machine at this time on front loading washing machines. Please let us know how you plan to use Sofft to treat your dress shirts.",208457577,A1PE0077HI218F,0,A1T79J0XQXDDGC,0,A1V6P1ZE6Q8YEW,1,A3UWM3KJYEL5XU,1,A9K0CV70JWG1W,1,0.6,2015-06-15 08:41:02 UTC
3BC9H1KCYUCNH091POA11IK9T28YWK,548,163,"Hey, this looks great. Just backed the pro plus with tpms. Can you tell me if this will work in my 2010 Suzuki SX4TW Your website says its not yet in the database.",574041322,A1PE0077HI218F,0,A1T79J0XQXDDGC,1,A1V6P1ZE6Q8YEW,1,A291KO368YRYCR,1,ANMWPCK7TJMZ8,0,0.6,2015-06-15 08:30:06 UTC
3LN3BXKGC0VNV9O1VIOVUID5O6IWGK,300,217,"I was one of the beta tester with this device .. This changed my way of parenting when it comes to wifi , and internet availability . Used to have a kid that stayed up all night watching nexflix . Now he gets 1 hr past bed time and bam . Well kids aint happy but I am .",319171845,A1PE0077HI218F,0,A1T79J0XQXDDGC,2,A1V6P1ZE6Q8YEW,0,A3HW4QDJB63OQ2,1,A9K0CV70JWG1W,0,0.6,2015-06-15 08:35:20 UTC
3QMELQS6Y5BGQKI9KB53VSSZ2D0R6A,248,78,I cant wait to use this with my M350 MiniITX case to make a cheap RaspNAS. Combine that with 3x 2.5 Hard Drives for 6TB of NAS storage.,261371655,A1PE0077HI218F,0,A1T79J0XQXDDGC,0,A291KO368YRYCR,2,A32QBXDPHHSTOD,1,A9K0CV70JWG1W,0,0.6,2015-06-15 08:23:56 UTC
3X0EMNLXEPPGTXHV8R9M2P8JIO3VPD,629,158,Got my keyboard last night. Its really low latency. I didnt realize delay.,681994346,A18JA2145UWXG,0,A1PE0077HI218F,1,A9K0CV70JWG1W,1,AKJ8CNFZH73K6,0,AQR70X1KIOP6B,1,0.6,2015-06-15 07:56:21 UTC
3ZFRE2BDQ9E2BQOWVF86H87I8YHZX4,933,63,Thanks MrClem!,1008109037,A1T79J0XQXDDGC,0,A291KO368YRYCR,1,A3Q92WMGIHEPSD,1,A9K0CV70JWG1W,1,AQR70X1KIOP6B,0,0.6,2015-06-15 08:03:00 UTC
3QTFNPMJC6IXZWAST9LXJ6GK6K8NZ9,550,90,Than you Chris!,578473775,A16U1L4R6WV5G2,1,A1PE0077HI218F,1,A1V6P1ZE6Q8YEW,0,A32QBXDPHHSTOD,0,A9K0CV70JWG1W,1,0.6,2015-06-15 07:58:40 UTC
3TZDZ3Y0JS6FFYLQKOT09B1OOGF190,636,16,"Lee Tsai Hi Lee, thanks for the feedback! Im not sure if its possible to do that, bit well look into it! Thanks again!",686630926,A1PE0077HI218F,1,A1T79J0XQXDDGC,0,A291KO368YRYCR,0,A3HW4QDJB63OQ2,1,A9K0CV70JWG1W,1,0.6,2015-06-15 08:23:23 UTC
36D1BWBEHN11B3MGS1XJJGHDGLZ2MG,675,13,"Lightfreq will be a perfect system for front door camera. Try to develop this system next, ill be happy to buy it and getting more from lightfreq.",733759399,A1T79J0XQXDDGC,1,A1ZFUBB7KVAT4G,1,A3HW4QDJB63OQ2,0,A9K0CV70JWG1W,0,AXMPSUNKUBEIL,1,0.6,2015-06-15 08:20:43 UTC
3Y3CZJSZ9KTK7GIVFSVY3MEZ6IP5R8,571,19,"Love the look of both speaker boxes and would be proud to wear the ClawHammer shirt all around RVA for you. I respect the effort being put in to handcraft your items and take the time to get it just right. Now that youve hit 8,000, cant wait to see the BeamBox in action!!!",605068999,A1V6P1ZE6Q8YEW,0,A32QBXDPHHSTOD,2,A3HW4QDJB63OQ2,1,A9K0CV70JWG1W,0,AKJ8CNFZH73K6,0,0.6,2015-06-15 08:20:28 UTC
31ANT7FQN827IM4SJNJ4PICTJ9QH5M,846,6,"I am sure it will be worth the wait, Hardware can always give you problems trying to make it as foolproof as possible.",904800959,A1T79J0XQXDDGC,0,A1V6P1ZE6Q8YEW,1,A32QBXDPHHSTOD,1,A3CFNUD7VR2E1E,1,A3Q92WMGIHEPSD,0,0.6,2015-06-15 08:35:57 UTC
3QE4DGPGBRBBM75HLCICZQUE4DJG4I,472,15,I think CASH Music is one of the better ways to fight for artists and go back to the grassroots of music.,493563875,A16U1L4R6WV5G2,0,A1ZFUBB7KVAT4G,1,A32QBXDPHHSTOD,1,ANMWPCK7TJMZ8,0,AXMPSUNKUBEIL,1,0.6,2015-06-15 07:49:48 UTC
3JMNNNO3B14XGFGUW336SEJ4END2W7,546,33,"JEL Please revisit our story as we have newly added internal dimensions upon your request. The secondary shelve can be useful in many ways. You can remove it to add more storage space, or keep it on as an extra divider. You can also place many items on this table while you are doing the work with the top table, such as stereo speakers or a few drinks, etc. Another purpose is that you can customize it for special equipment such as cameras, tools, etc. Once again, many thanks for your support and being the first backer of this project.",571559806,A291KO368YRYCR,0,A2RD843ESYKRP2,1,A3HW4QDJB63OQ2,1,A9K0CV70JWG1W,0,ANMWPCK7TJMZ8,1,0.6,2015-06-15 08:01:50 UTC
3W0XM68YZPVZWU4HOLKPZKF4ZAR1KU,738,1044,Cant wait for a family reunion water fight!,813608322,A1T79J0XQXDDGC,1,A32QBXDPHHSTOD,0,A3HW4QDJB63OQ2,1,A9K0CV70JWG1W,1,AQR70X1KIOP6B,0,0.6,2015-06-15 07:56:01 UTC
3ABAOCJ4R84I3MO1UCNKFYFGWRCMQD,858,3836,"Holy crap, alot happned tonight!  Almost at the last Stretch!  Gratz!",918228637,A16U1L4R6WV5G2,-2,A32QBXDPHHSTOD,2,A3HW4QDJB63OQ2,2,A3KOVCQYR8K3HY,1,ANMWPCK7TJMZ8,0,0.6,2015-06-15 07:40:03 UTC
32CAVSKPCEPDZQ9TIZOR57O211O1UQ,812,9,"It was really nice to see my 3D printed Lenz2 XL from my thingiverse page showing up on Engadget and getting some press from other sites around the world. Still working on refine my 3D printed turbine, not that it will ever fold or produce much in the way of energy. Since its been a while I was wondering what sort of progress has been made over the past month. Im interested to see what design they come up with for a foldable wind turbine that isnt too heavy and compact. My turbine is 45cm diameter and 60100cm high, my estimates come up at around 1020 Watts on the low end of the scale to about 50 for the higher version. Getting a proper sized generator is proving to be the most difficult thing by far.",881928412,A1V6P1ZE6Q8YEW,0,A38K3QQPV8CTPC,1,A3CFNUD7VR2E1E,1,A3HW4QDJB63OQ2,1,AXMPSUNKUBEIL,0,0.6,2015-06-15 09:48:47 UTC
3M4KL7H8KVNSXFJSMHQOP1AMYF661T,357,9,"Hey guys, I got the bulbs a while back and I really like the quality, functionality etc. I felt really satisfied with my decision to pledge for 4 of these bulbs. I had opted for 1 of them as halfnhalf black but I got all white. The problem that Im facing with the bulbs is that they seem to fluctuate brightness very frequently. I hope other backers can observe their bulbs and share with everyone.",377611462,A1PE0077HI218F,1,A1V6P1ZE6Q8YEW,1,A3CFNUD7VR2E1E,1,A3HW4QDJB63OQ2,0,A3UWM3KJYEL5XU,0,0.6,2015-06-15 08:42:22 UTC
36FQTHX3Z3RUDUE25CLFOABBA0V3B3,351,375,"Zac You can do both! Depends on how you want to use the Core, but both are completely possible. Charlie Definitely  the setup process is super easy, and also super easy to redo when you move to a different network. Chris Michael Definitely! Well publish everything from the demos and the Shields.",373368980,A1T79J0XQXDDGC,0,A291KO368YRYCR,1,A3HW4QDJB63OQ2,1,A3UWM3KJYEL5XU,1,AQR70X1KIOP6B,0,0.6,2015-06-15 08:40:28 UTC
3VGET1QSZ0Z42GD02FK1O50CP3Z7WS,470,11,fstop Ive just pledged for bluetooth and cellular and am excited about this. Although Im keen to hear if backers or your good selves can think of other applications rather than photography,490074944,A1PE0077HI218F,0,A1T79J0XQXDDGC,1,A3HW4QDJB63OQ2,1,A9K0CV70JWG1W,1,AKJ8CNFZH73K6,0,0.6,2015-06-15 08:33:01 UTC
3MA5N0ATTCBSXVKKL99ASA5YVNZWKN,373,4,"BTW, I let various devices batteries die, and your app worked perfectly!",394648626,A1PE0077HI218F,0,A1V6P1ZE6Q8YEW,1,A3UWM3KJYEL5XU,1,AKJ8CNFZH73K6,0,AQR70X1KIOP6B,1,0.6,2015-06-15 08:58:35 UTC
3UAU495MIISYVIGUO1M2H31AUCXUO5,997,348,"Just signed up for the EaryBird but wondered how to add on additional modules. Love the USB and Breathalyzer, but didnt see where to add these to my pledge as mentioned in your infographic.",1073203998,A1V6P1ZE6Q8YEW,0,A32QBXDPHHSTOD,1,A9K0CV70JWG1W,1,AQR70X1KIOP6B,0,AXMPSUNKUBEIL,1,0.6,2015-06-15 07:55:56 UTC
3EHVO81VN5L8U439I0HSMSZC7TLH14,16,64,"I am with Stefan even if you do not make it to the 25K I would love for you to do the weekend workshop on how to build the Farm of the Future instead of the rap video. Thank you, Clarke",15122854,A1PE0077HI218F,1,A1T79J0XQXDDGC,0,A1V6P1ZE6Q8YEW,1,A3HW4QDJB63OQ2,1,A9K0CV70JWG1W,0,0.6,2015-06-15 08:33:01 UTC
3TD33TP5DL2UXFDNER0PBIPHGANAB6,601,19,"I am very interested in this project but for it to be very useful for me, it really needs a small handful of features which you may or may not be planning on including. These are inspired by JEdit. They are 1. Select a rectangle field. 2. Advanced search and replace like the Beanshell search. 3. Sorting lines within a selected region.",643363704,A18JA2145UWXG,0,A1PE0077HI218F,0,A1T79J0XQXDDGC,0,A1V6P1ZE6Q8YEW,1,A3HW4QDJB63OQ2,1,0.4,2015-06-15 08:35:09 UTC
3PUV2Q8SV44SVMGZY1RR1JXN1DKDBB,407,1,If I was you Id buy a few lottery tickets.....both at once shows some luck.,424219599,A16U1L4R6WV5G2,1,A1V6P1ZE6Q8YEW,0,A2BO8M77CS3SGZ,1,A9K0CV70JWG1W,0,AXMPSUNKUBEIL,0,0.4,2015-06-15 07:43:01 UTC
3XJOUITW8URMGHEL39OW1CA8QZ9TQM,358,8,"Good luck guys, were in Hoboken too",378746327,A1T79J0XQXDDGC,1,A1V6P1ZE6Q8YEW,0,A1ZFUBB7KVAT4G,1,A3HW4QDJB63OQ2,0,A9K0CV70JWG1W,0,0.4,2015-06-15 08:57:44 UTC
36FFXPMST9OTQWAAO2F3YOCK04WHOS,803,3,"One other thing. Though I am not hearing impaired, I have several deaf friends who love Apple products and want to get an Apple Watch. But since there currently isnt a keyboard, theyd only be able to communicate via dictation to Siri, which isnt possible for them. So hopefully Apple will allow 3rd party keyboards and if so, this app will be wonderful for them and all of us. Thanks!",867771779,A1T79J0XQXDDGC,1,A1V6P1ZE6Q8YEW,0,A1ZFUBB7KVAT4G,1,A9K0CV70JWG1W,0,AQR70X1KIOP6B,0,0.4,2015-06-15 08:02:50 UTC
3U18MJKL1UMKR3ZI1V1P88FZX2MNCA,917,23,"Oh, and to anybody who wants to tweet about it you can use hashtag HighFrontier, and this shortened URL httpkck.st1tAsuQI Thanks for helping to spread the word!",988679902,A1T79J0XQXDDGC,0,A1V6P1ZE6Q8YEW,0,A32QBXDPHHSTOD,0,A3HW4QDJB63OQ2,1,A9K0CV70JWG1W,1,0.4,2015-06-15 07:30:47 UTC
3D17ECOUOEVT0WWA3FSQIYY2OO513J,173,90,"Hi Michelle, Yes thats what we thought, too! Youre welcome ",193205478,A16U1L4R6WV5G2,0,A1T79J0XQXDDGC,0,A2RD843ESYKRP2,1,A9K0CV70JWG1W,1,ANMWPCK7TJMZ8,0,0.4,2015-06-15 07:49:00 UTC
3J9UN9O9J3S4ELDHAHGDK0WHFTKJ09,283,120,"Yes, now this is a more healthy turn of the project. Shawn, remember honisty leeds last longest. Can you please answer these questions 1. What is the mAh rating on your prototype Is it 35.6 mAh 2. Do you still think the mAh rating on the final product will be 1150 mAh after the below scrutiny 3. If you still think it will be 1150 mAh how do you plan to solve the charging problems Longer charging time  higher voltage or thicker conductors",298476022,A1V6P1ZE6Q8YEW,0,A1ZFUBB7KVAT4G,0,A32QBXDPHHSTOD,0,A9K0CV70JWG1W,1,AQR70X1KIOP6B,1,0.4,2015-06-15 08:50:14 UTC
3HY86PZXPYIWAUC7SZ9M1P2ZFDUE1M,594,7,All stretch goals met. Awaiting disclosure of the 200 target that has been reached. Any new stretch goals,635470758,A1T79J0XQXDDGC,0,A1V6P1ZE6Q8YEW,0,A1ZFUBB7KVAT4G,1,A32QBXDPHHSTOD,1,A9K0CV70JWG1W,0,0.4,2015-06-15 08:58:17 UTC
37Y5RYYI0P55AE2I0NEYLFAFLJHXSX,682,16,Alexandra Herzog  Correct!,743180376,A1PE0077HI218F,1,A9K0CV70JWG1W,0,AKJ8CNFZH73K6,0,ANMWPCK7TJMZ8,0,AQR70X1KIOP6B,1,0.4,2015-06-15 08:20:43 UTC
362E9TQF2HQ5UE4W61KGTR4X9VKGIX,599,2,Nice to see that you have added the solder pads for external power. I would like to add a small solar panel that would serve to keep the rechargeable AAA batteries in the unit topped off. Will the power circuitry support that configuration,641968675,A1T79J0XQXDDGC,0,A1V6P1ZE6Q8YEW,0,A3HW4QDJB63OQ2,0,A9K0CV70JWG1W,1,AKJ8CNFZH73K6,1,0.4,2015-06-15 08:56:22 UTC
3UEBBGULPFO4P531PY3CU9SW2B6UFJ,71,11,Commodore64 support LoL!,66038634,A1ZFUBB7KVAT4G,0,A2RD843ESYKRP2,1,A32QBXDPHHSTOD,0,A3Q92WMGIHEPSD,1,A9K0CV70JWG1W,0,0.4,2015-06-15 07:59:23 UTC
3ULIZ0H1VA5WEBJEHYGJXVWM2KW159,187,31,"I still would like to see some more videos showing how does it handle uphill, downhill, on a pavement or grass, see an efficiency of chainless drive, interface and usability of smartphone application. So far we havent seen much of it and it is hard to get the feeling of how it handles in real world from shaky video or static images. Usability is important for a bike that is supposed to be used daily in a city. Unless it is just a fashion accessory going to be used once a week to visit local caf. I understand you have to be busy right now, but showing progress and responding to requests of backers is indeed crucial at least for me. Cheers and fingers crossed.",203465906,A16U1L4R6WV5G2,0,A1T79J0XQXDDGC,0,A1V6P1ZE6Q8YEW,0,A9K0CV70JWG1W,1,ANMWPCK7TJMZ8,1,0.4,2015-06-15 07:42:25 UTC
3IZPORCT1F9WN92QGUW7SJHPBRGHR1,826,8,"My wife and I had a wonderful time at the Homebrew Reunion. Thank you to Jol, Lee, Hilda, and the original Homebrew members who made this event possible! Although the 30,000 stretch goal was not met at the final tally, I was wondering if there was an official photographer for the event. If so, I would love to view the album.",890139138,A1V6P1ZE6Q8YEW,0,A3HW4QDJB63OQ2,0,A3KOVCQYR8K3HY,1,A9K0CV70JWG1W,0,AKJ8CNFZH73K6,1,0.4,2015-06-15 08:19:33 UTC
3DZKABX2ZI5XZ88R3MNGIP9CJ5OVCZ,107,27,Hi James I updated you just now and all other backers with pm . Thank You,107206217,A32QBXDPHHSTOD,0,A3HW4QDJB63OQ2,1,A9K0CV70JWG1W,0,AKJ8CNFZH73K6,1,AQR70X1KIOP6B,0,0.4,2015-06-15 07:48:23 UTC
3X55NP42EOGWHOFCOH3GJUG0R4B3PP,516,19,"Bryan UVin, we will update in the beginning of June. Thanks for thinking about us ",542210804,A1PE0077HI218F,1,A1T79J0XQXDDGC,0,A1ZFUBB7KVAT4G,0,A3HW4QDJB63OQ2,1,A9K0CV70JWG1W,0,0.4,2015-06-15 08:24:35 UTC
3SU800BH86S1GUTA3EE668WA9DGQUA,725,2242,"Joseph, Yes, there will be pads for unused DIO pins.",798944392,A1PE0077HI218F,1,A1T79J0XQXDDGC,0,A1V6P1ZE6Q8YEW,0,A2RD843ESYKRP2,1,A9K0CV70JWG1W,0,0.4,2015-06-15 08:28:18 UTC
37SDSEDIN92F1T2GFWNM9F6D4AX18B,426,7,Wow! made it by a whisker! Now comes the hard part...,443060666,A18JA2145UWXG,1,A1PE0077HI218F,0,A2RD843ESYKRP2,0,A9K0CV70JWG1W,1,AKJ8CNFZH73K6,0,0.4,2015-06-15 07:58:20 UTC
32TZXEA1OLKEISFE3TX9S3Q82O1417,278,35,"Surely someone will release compatible connectors, maybe even you should be good for business reaching out to MicroRAX customers and vice versa. Its good to have more than one standard to suite different needs etc. as long as they are compatible!",292573961,A1PE0077HI218F,1,A1V6P1ZE6Q8YEW,0,A32QBXDPHHSTOD,0,A3KOVCQYR8K3HY,1,A9K0CV70JWG1W,0,0.4,2015-06-15 08:15:45 UTC
3JYPJ2TAYI8RX0V58C4IK35XUUFFP9,942,205,"I might be really dumb but have no idea how to get started. The instructions are telling me to open it But I cant open it not even with a flat head screwdriver. Besides that, I love the look and feel of it so far!! Its smaller than I expected too! Thanks!",1016357821,A1V6P1ZE6Q8YEW,0,A291KO368YRYCR,0,A32QBXDPHHSTOD,1,A9K0CV70JWG1W,1,AKJ8CNFZH73K6,0,0.4,2015-06-15 08:08:31 UTC
3D0LPO3EABZFCR0ZY2JRKO7NQ09YO8,679,5,Hi Brent. Again sorry for the mix up. We have sent you a new Monopod directly from Amazon here is the Order Number 11113604573340244 I will let you know as soon as I have tracking. Thanks again for your support...,736600973,A16U1L4R6WV5G2,1,A1V6P1ZE6Q8YEW,0,A32QBXDPHHSTOD,1,A3CFNUD7VR2E1E,0,A9K0CV70JWG1W,0,0.4,2015-06-15 07:36:15 UTC
30F94FBDNRKZCBCWKRR66NF94Z8TBA,530,10095,Kevin Thanks. The results will certainly affect the direction we will be taking in the coming weeks.,557230947,A1PE0077HI218F,0,A1V6P1ZE6Q8YEW,0,A3HW4QDJB63OQ2,1,A9K0CV70JWG1W,0,AKJ8CNFZH73K6,1,0.4,2015-06-15 08:33:40 UTC
3PZDSVZ3J5HHWZM38GV7PA3B5P5N4X,838,35,So close Im hoping to get this kickstarter project for my 2 cats plus my brothers cats,898927365,A1V6P1ZE6Q8YEW,0,A3HW4QDJB63OQ2,0,A9K0CV70JWG1W,0,AKJ8CNFZH73K6,0,AQR70X1KIOP6B,2,0.4,2015-06-15 08:12:04 UTC
3A9LA2FRWSEGK5O2PT2ZH13DC80XHC,982,1,"Thank you, Rukesh! And yes I agree, I think educational resources are a key part of making electronics more accessible.",1057752953,A18JA2145UWXG,0,A2RD843ESYKRP2,1,A3HW4QDJB63OQ2,0,A9K0CV70JWG1W,0,AKJ8CNFZH73K6,1,0.4,2015-06-15 08:24:01 UTC
33KGGVH24UH5GU3ON4ZEPEN6VJ51XI,38,136,"Great project... pledged for 3... i am interested in buying a set of playbulb candles... but the online store does not ship to Malta, Europe. any idea where i can buy them from Thanks",33236797,A16U1L4R6WV5G2,0,A3HW4QDJB63OQ2,0,A3KOVCQYR8K3HY,1,A9K0CV70JWG1W,0,AXMPSUNKUBEIL,1,0.4,2015-06-15 07:40:10 UTC
3RWO3EJELH907L1X1DPXV113TKX1PV,786,11,"Patrick Yes, I can hold off shipment of your kit to the end of July if that helps. Thats no problem.",851595649,A1PE0077HI218F,1,A1ZFUBB7KVAT4G,1,A2RD843ESYKRP2,0,A32QBXDPHHSTOD,0,A9K0CV70JWG1W,0,0.4,2015-06-15 07:55:40 UTC
3RHLQY6EDT48ANVQJMH4T5RHRL3D45,964,27,Ken .. We have left you a personal message with the tracking . Thanks !,1041475835,A32QBXDPHHSTOD,0,AKJ8CNFZH73K6,0,ANMWPCK7TJMZ8,0,AQR70X1KIOP6B,1,AXMPSUNKUBEIL,1,0.4,2015-06-15 07:49:06 UTC
3EHIMLB7F7ZQ54NUHLQ712MKLZRH8O,48,73,Alon Walter Thanks for your input,45179890,A1PE0077HI218F,0,A1V6P1ZE6Q8YEW,1,A3Q92WMGIHEPSD,0,A3UWM3KJYEL5XU,1,A9K0CV70JWG1W,0,0.4,2015-06-15 08:39:07 UTC
34D9ZRXCYRUTE1UPPDMK17ZHKY9AS7,517,0,Hi Mike Went out early this week so should be any moment. Sorry for the delay!  Thanks again for your support. Have a great day jenine,545897820,A1V6P1ZE6Q8YEW,0,A32QBXDPHHSTOD,0,A3HW4QDJB63OQ2,1,A9K0CV70JWG1W,1,AKJ8CNFZH73K6,0,0.4,2015-06-15 07:53:13 UTC
3HKIF5DF6YXCJDBT27E3GY5UQ5Y9G8,316,433,Yigit Altay thank you for all your suggestions.,330114753,A1T79J0XQXDDGC,0,A1V6P1ZE6Q8YEW,0,A3HW4QDJB63OQ2,1,A9K0CV70JWG1W,1,AN6WT1D6EQ8V5,0,0.4,2015-06-15 09:54:32 UTC
3P4ZBJFX2V3HH9S6KYIDCXDTNRIWFL,296,174,"Hi Sammy, Thanks! Weve been so busy we forgot to update our own website! Well do that shortly, thanks for the reminder.  Hi Julius, Yes, we definitely are planning a whole slew of goals. More to come on Monday. Hi Joseph, Well be talking to Kickstarter about possible new rewards. Also, well have blink1 mk2 available on our webstore after weve mailed out the Kickstarter rewards. Everyone else, thanks for the kind words! Weve been floored at the sudden popularity and well have a proper update shortly.",307853888,A1T79J0XQXDDGC,0,A1V6P1ZE6Q8YEW,0,A3UWM3KJYEL5XU,1,A9K0CV70JWG1W,0,AKJ8CNFZH73K6,1,0.4,2015-06-15 08:36:07 UTC
31J7RYECZLQAG0MZ9LWQEKSJOAW1LX,542,2,Nice to hear feedback from Jeff.We are working on an updated App to make it more user friendly.,569450948,A1T79J0XQXDDGC,0,A1V6P1ZE6Q8YEW,0,A3HW4QDJB63OQ2,1,A9K0CV70JWG1W,1,AQR70X1KIOP6B,0,0.4,2015-06-15 08:13:19 UTC
3LB1BGHFL2WVPJ57UJ5QEYDAP8QYTU,540,163,"We made it The Shockproof Inflatable System will now be a standard feature in all you backers PRO DRYBAG 45L! Here are answers to your great questions and comments Video An instruction video will be presented as soon as we together with our partners have time to put together a short video on how simple the PRO DRYBAG 45L is in fact to use. Race Tee With this great progress it looks like we can manage to reach our 100K Stretch Goal so you can get the same Race Tee as our professional athletes in TEAM SUBTECH are using. Thunderclap 93 of 100. We still need 7 more of you backers to help spread the word via Thunderclap otherwise the message will not be sent on Monday httpswww.thunderclap.itprojects19541 Airport safe Yes, the PRO DRYBAG 45L is completely airport safe. We have now talked to several different airline companies and none of the ones we have spoken to or traveled with have said that the PRO DRYBAG 45L is too large to bring as a carryon luggage and when it comes to the Shockproof Inflatable System it is no safety restrictions to bring it on board airplanes. Inside Mesh pocket The Shockproof Inflatable System is designed to not only protect your gear but also to hold your gear in place and in combination with the ergonomic fit thanks to the airtight zipper it will prevent the PRO DRYBAG 45L from move around when traveling in rocky terrain or at high speed. Thanks again for your great support!",568077811,A1T79J0XQXDDGC,0,A1V6P1ZE6Q8YEW,0,A3HW4QDJB63OQ2,1,AKJ8CNFZH73K6,0,AXMPSUNKUBEIL,1,0.4,2015-06-15 07:49:11 UTC
3MVY4USGB6N8KJDN11EXI5N0X6EISJ,785,11,"Vincent, The plastic will be mostly 0.04 with some thicker variety. This I found to work great in vacuum forming. The thickest I would recommend would be 116 0.0625 which also forms reasonably well, but requires a little more heating. Ive even gone as thick as 18, but that is more difficult to work with. It sounds like 116 might be a good thickness.",851560387,A16U1L4R6WV5G2,0,A1T79J0XQXDDGC,0,A3HW4QDJB63OQ2,0,A3KOVCQYR8K3HY,1,ANMWPCK7TJMZ8,1,0.4,2015-06-15 08:03:55 UTC
3FJ2RVH25Z6M4J3M3STEEUBTGMS29H,121,42,"Hi Robert , Thingy is on the way thanks for the reply. Enjoy the Tshirt ",120572553,A1ZFUBB7KVAT4G,1,A32QBXDPHHSTOD,1,A3Q92WMGIHEPSD,0,A9K0CV70JWG1W,0,AXMPSUNKUBEIL,0,0.4,2015-06-15 08:37:28 UTC
3FO95NVK5C0LDIG6RO86WXORK2WRSV,896,16,"Great idea, love the project. Wasnt however really grabbed by the incentives. How about a mini technical demo or 3040 page book or well designed pamphlet on how you built the site Use the visual budget as worked examples. I love infogrpahics butt having them on my wall doesnt do it for me. Good luck a worth while and fantastic idea.",960921391,A1PE0077HI218F,1,A1T79J0XQXDDGC,0,A32QBXDPHHSTOD,1,A3HW4QDJB63OQ2,1,AQR70X1KIOP6B,-1,0.4,2015-06-15 08:41:44 UTC
3HFWPF5AK9JTUGV4GY7AEZLBEOGS3S,167,19,"Hi Marian  Customs is always an adventure for German  Austrian backers. Glad everything arrived safely and please let me know if you have any questions during assembly! Regards, Tyler Nehowig",184562563,A1T79J0XQXDDGC,0,A32QBXDPHHSTOD,1,A3HW4QDJB63OQ2,1,A9K0CV70JWG1W,0,AQR70X1KIOP6B,0,0.4,2015-06-15 07:56:55 UTC
3V0TR1NRVA2ACGSEZCQ234JB6I6A40,117,8,We just added another 5 to our pledge since you are our featured Kickstarter project once again! We are cycling between the Seed Chicago Projects.,116262908,A1T79J0XQXDDGC,1,A1V6P1ZE6Q8YEW,0,A32QBXDPHHSTOD,0,A9K0CV70JWG1W,1,AQR70X1KIOP6B,0,0.4,2015-06-15 08:29:53 UTC
3OID399FXG7I83SF33DNK9O8GBCDFT,425,9,Love shrimp! But does anyone know any good ways of cooking them,441279698,A1V6P1ZE6Q8YEW,0,A3CFNUD7VR2E1E,0,A3HW4QDJB63OQ2,1,A9K0CV70JWG1W,1,AQR70X1KIOP6B,0,0.4,2015-06-15 08:31:22 UTC
3JMQI2OLFZ5UWV5W1RW0SEXHI2YNDA,141,6,Josh Apter I have pledged for the 99  international postage Early Bird Special  I have an ipad air  I assume that you can substitute an Air Clip adapter for the Tshirt,143131956,A1PE0077HI218F,1,A1T79J0XQXDDGC,0,A1V6P1ZE6Q8YEW,0,A32QBXDPHHSTOD,1,A9K0CV70JWG1W,0,0.4,2015-06-15 08:27:34 UTC
3DGDV62G7O97W6JTKHPB0KB8LQA2PC,489,218,"Thanks everyone! Maple Clare Tylek Kettenburg was born July 9th  and mother and baby are both doing well! I will have an update in the next few days answering all the timeline, survey, ordering extras, etc questions  so stay tuned for that  Im just finalizing dates, orders, etc first. For anyone concerned  my absence did not affect timelines  as we were waiting on final prototypes and parts orders last week.",518514614,A32QBXDPHHSTOD,0,A9K0CV70JWG1W,0,AKJ8CNFZH73K6,0,ANMWPCK7TJMZ8,1,AXMPSUNKUBEIL,1,0.4,2015-06-15 08:03:13 UTC
3T6SSHJUZFAJQ5ARWPKJE3HDO8CIIR,490,52,"Hi Paul! Cant wait to start  Quick question Ive bought the friends deal, how does it work How can I invite the other to jump in And we both have our separate accounts, right",518590288,A1V6P1ZE6Q8YEW,0,A1ZFUBB7KVAT4G,1,A3HW4QDJB63OQ2,1,A9K0CV70JWG1W,0,AKJ8CNFZH73K6,0,0.4,2015-06-15 08:35:44 UTC
3WJGKMRWVI9B5R85C1NMC335JYKDCI,617,36,"Thanks for the comment, Tan. I did consider the Raspberri Pi, but rejected it for one main reason I didnt want supporters to buy extra hardware. That said, I will send out an update soon and get peoples opinions.",662264671,A2RD843ESYKRP2,0,A32QBXDPHHSTOD,0,A3KOVCQYR8K3HY,1,A9K0CV70JWG1W,0,AQR70X1KIOP6B,1,0.4,2015-06-15 07:55:36 UTC
3ZG552ORAM4K1QGP6TYA6C0Q7EB2VX,750,66,"Im with Ekki on the online drawing with friends feature! I recall back in 5 year using OC to draw with friends was one of the most fun things, otherwise that program was really awful tho since their brushes were poor... I almost forgot about that thing! x3",823124401,A1T79J0XQXDDGC,0,A1V6P1ZE6Q8YEW,0,A3CFNUD7VR2E1E,0,A3HW4QDJB63OQ2,0,AQR70X1KIOP6B,2,0.4,2015-06-15 08:34:37 UTC
3YOAVL4CA0HBDO0MB461KXAKF3DZ4Q,258,237,Just uped my pledge,271065963,A1T79J0XQXDDGC,0,A1V6P1ZE6Q8YEW,0,A3CFNUD7VR2E1E,1,A9K0CV70JWG1W,1,AKJ8CNFZH73K6,0,0.4,2015-06-15 08:39:04 UTC
3QHITW7OYO9H1LFCX9XF67KG2AOQAY,150,11,"Done  have increased my pledge accordingly 60, if you could note to add leggings that would be great  thank you!",159764729,A18JA2145UWXG,0,A3HW4QDJB63OQ2,1,A9K0CV70JWG1W,1,AQR70X1KIOP6B,0,AXMPSUNKUBEIL,0,0.4,2015-06-15 07:49:49 UTC
