HITID,index,comment_index,comments,keys,Worker1,Answer1,Worker2,Answer2,Worker3,Answer3,Worker4,Answer4,Worker5,Answer5,Avg,Date
3TCFMTM8HEO4FE0RZFELZOTAIA5219,399,17,I got mine ... havent tried them yet ... next weekend I will try them out ... so far thx  ... Im from Europe ... INTERNATIONAL STINKY SQUARED,418519191,A1PE0077HI218F,0,A1T79J0XQXDDGC,0,A1V6P1ZE6Q8YEW,0,A3HW4QDJB63OQ2,0,A9K0CV70JWG1W,1,0.2,2015-06-15 08:38:51 UTC
386659BNTLHXJ4XDKSA7G00VLCK01M,157,28,"I was thinking, wouldnt it be nice for a future set that you could reuse the pieces you take out for the holes and fold them into cubes as a cat toy",173387281,A1V6P1ZE6Q8YEW,0,A291KO368YRYCR,0,A3CFNUD7VR2E1E,1,A3HW4QDJB63OQ2,0,A9K0CV70JWG1W,0,0.2,2015-06-15 08:19:08 UTC
3N2YPY1GI6YCW6S5ZDTB8D9F4H1VES,123,125,"Jason Doege, PR Taylor, Paul Kourany, Francisco Javier Snchez Rivas, Peter Hollands, nick weldin, burkmurray So glad youve received! Thanks for the messages! Ariane Nazemi 2color signatures aka colorcodes arent supported yet. They will be soon, hopefully before the end of April. Were running a little slow with all the emails... You might check out this info to help tweak the signature generation httpcmucam.orgprojectscmucam5wikiSomeTipsonGeneratingColorSignatures George Konstantinou less light can sometimes mean underexposure. Were working on some improvements to the autoexposure compensation. This link contains some specific info that youll find useful httpcmucam.orgprojectscmucam5wikiSomeTipsonGeneratingColorSignatures J Dubrow sent you a message. Lets keep hardware and software issues out of the KS site. thanks!",121842661,A1T79J0XQXDDGC,0,A1V6P1ZE6Q8YEW,0,A1ZFUBB7KVAT4G,1,A3HW4QDJB63OQ2,0,AQR70X1KIOP6B,0,0.2,2015-06-15 08:35:54 UTC
3DWGDA5POF4DC5YTNPYW1TQLF8WV18,703,112,I like the idea of the distributor deal. I have sold Ego and Boosted inthrough my shop but didnt find out about them until after they were in full production. Do you have plans for any kind of POS displays inshop marketing to go along with this pledge level,768904058,A1T79J0XQXDDGC,0,A3HW4QDJB63OQ2,0,A9K0CV70JWG1W,0,AKJ8CNFZH73K6,0,AQR70X1KIOP6B,1,0.2,2015-06-15 08:17:59 UTC
3HY86PZXPYIWAUC7SZ9M1P2ZFDV1EA,485,46,"For anyone having issues with the Rain Repellent on windshield, PLEASE be sure to completely clean the windshield before applying the product. We recommend a cleaner or simply soap and water. Windshield must be completely clean and dry prior to application. We have seen an increase in performance when surface is absolute clean. I hope this helps for anyone having issues.",512578071,A1PE0077HI218F,1,A32QBXDPHHSTOD,0,A3CFNUD7VR2E1E,0,A9K0CV70JWG1W,0,AXMPSUNKUBEIL,0,0.2,2015-06-15 08:21:29 UTC
388FBO7JZRTXU60NXNJE5Z7I0Q4NYI,541,17,"Any update would, once again, be sincerely appreciated.",568214989,A1PE0077HI218F,1,A1T79J0XQXDDGC,0,A3HW4QDJB63OQ2,0,A9K0CV70JWG1W,0,AXMPSUNKUBEIL,0,0.2,2015-06-15 08:26:11 UTC
3UOMW19E6D6G1ETCXV53ERFD6HM5C2,625,11,Hey Bob...yes as far as Im aware the only thing thats different about wireless vs hardwired is the keypad just acts like a garage door remote...so there still should be a place for you to connect your unit to. Did you get my response via email a few days ago Maybe it didnt go through but if you just email me a picture of your garage door opener Ill look up the manual online and post directions for you.,678553536,A1PE0077HI218F,1,A1T79J0XQXDDGC,0,A1V6P1ZE6Q8YEW,0,A1ZFUBB7KVAT4G,0,AQR70X1KIOP6B,0,0.2,2015-06-15 08:34:40 UTC
3Y7LTZE0YTMAUMU1QAXJX18EEG0ZUC,99,24,"Jim, yes there will be detour boards!",98199993,A1T79J0XQXDDGC,0,A1V6P1ZE6Q8YEW,0,A1ZFUBB7KVAT4G,1,A32QBXDPHHSTOD,0,AKJ8CNFZH73K6,0,0.2,2015-06-15 07:36:13 UTC
39KMGHJ4RZAXCFCVO9672VHLGKE00J,952,73,I would like to buy two... How is this done,1026200929,A1PE0077HI218F,0,A1T79J0XQXDDGC,0,A3HW4QDJB63OQ2,0,A9K0CV70JWG1W,1,ANMWPCK7TJMZ8,0,0.2,2015-06-15 07:58:04 UTC
3EGKVCRQFWSVTXBQUXE5E47OJ1QYB4,972,3,"The internal antenna versions and kits are shipping now, the external antenna versions will ship next week. Hope this helps! Jason",1050319360,A1T79J0XQXDDGC,0,A1V6P1ZE6Q8YEW,0,A3HW4QDJB63OQ2,1,A3UWM3KJYEL5XU,0,AQR70X1KIOP6B,0,0.2,2015-06-15 08:38:03 UTC
3BDORL6HKKD561RAU2I6HSK9YZBCRN,14,25,"Hi Chris, With the 370395 pledge it is a ChronoController, the Lens Apparatus, an adjustable gear belt which goes around the lens and mates to the Apparatus. It also includes a battery pack 8xaa, a shirt, and sticker. The only thing you need is a 15mm dslr rod system. Generally they can be found as low as 3540 dollars for an inexpensive one. Ill get some shots of the various kits this weekend. ",14535248,A1PE0077HI218F,1,A1V6P1ZE6Q8YEW,0,A9K0CV70JWG1W,0,AQR70X1KIOP6B,0,AXMPSUNKUBEIL,0,0.2,2015-06-15 07:54:07 UTC
3O71U79SRBPUG23EMGCPAYUHEFYSM9,915,10,"Ive been checking the documentation pages for details on what steps Ill need to take to link the two units to get RTK connections sent from the base to the rover, but have yet to find any details. Will these be coming soon Also, given that the Piksi is a PCBlevel solution, I want to make sure I have all the parts Ill need to hook everything up when my units arrive. So, just to make sure, will I need to purchase any additional parts, such as JST connectors, etc., to make everything work If so, can you provide a list so I can get these parts ordered in advance. And, it would be nice to get the specs and part numbers for the PCB edge connectors so I can get spares for other applications. Can you add this information to the documentation or, if Ive missed it, tell me where this is documented Wayne",985736936,A1PE0077HI218F,0,A1V6P1ZE6Q8YEW,0,A3KOVCQYR8K3HY,0,A9K0CV70JWG1W,0,ANMWPCK7TJMZ8,1,0.2,2015-06-15 08:31:20 UTC
302OLP89DZ7D7K5TSRWKM2VZYVNACD,610,26,Thrilled about IFTTT support! Still very concerned that the droplets only last less than 2 years and need to be replaced. Especially as the implication from the recent post is that the droplets will cost 20 each.,653179030,A1T79J0XQXDDGC,-1,A1V6P1ZE6Q8YEW,0,A9K0CV70JWG1W,1,ANMWPCK7TJMZ8,-1,AQR70X1KIOP6B,2,0.2,2015-06-15 07:57:15 UTC
3J5XXLQDHMB9M8C8ATCFPM5IDSC3VA,598,16,If you need testers i work in a phone shop so have access to many devices,639895345,A1PE0077HI218F,1,A1V6P1ZE6Q8YEW,0,A2RD843ESYKRP2,0,A32QBXDPHHSTOD,0,A9K0CV70JWG1W,0,0.2,2015-06-15 08:22:37 UTC
3YKP7CX6G2FCEDFP7OO51RNRF2H7BC,890,6,Only 3 hours left!,953245600,A1PE0077HI218F,1,A1V6P1ZE6Q8YEW,0,A3ITZNJQUTIZ4C,0,A9K0CV70JWG1W,0,AKJ8CNFZH73K6,0,0.2,2015-06-15 08:20:31 UTC
3QD8LUVX4XY44C47OR1QS40N7Z9X5V,68,13,Nous sommes prts  rvolutionner la mode Online ! Are you,64857294,A3CFNUD7VR2E1E,0,A3HW4QDJB63OQ2,0,A3KOVCQYR8K3HY,1,AKJ8CNFZH73K6,0,AQR70X1KIOP6B,0,0.2,2015-06-15 08:41:31 UTC
3NZ1E5QA6Z1XR916JV98379VOWMB51,271,17,"Jesse That wont be a problem. I have no idea if people like it or not, I just wanted to give the option, and find out. I am still pretty new to kick starter, and Im not surewhat is a good idea, and what people will like. Thanks for the input, Ill be curious to see if people like it or not.",283133908,A1PE0077HI218F,1,A1V6P1ZE6Q8YEW,0,A3HW4QDJB63OQ2,0,A9K0CV70JWG1W,0,AQR70X1KIOP6B,0,0.2,2015-06-15 08:18:51 UTC
3JGHED38EDR8RL80HG2P92LS0BZY7I,126,104,"Chaiyut If you mean for max current, like for charging, we are limited to 500mA .5A, so 1A would be fine.",124023981,A1V6P1ZE6Q8YEW,0,A32QBXDPHHSTOD,0,A3CFNUD7VR2E1E,1,A3HW4QDJB63OQ2,0,A9K0CV70JWG1W,0,0.2,2015-06-15 08:22:42 UTC
3QGTX7BCHP2T974MP9PBPPGYFZ8Z5V,266,1190,fight the urge to sellout to Amazon...,277120736,A1V6P1ZE6Q8YEW,0,A32QBXDPHHSTOD,1,A3Q92WMGIHEPSD,0,A9K0CV70JWG1W,0,AQR70X1KIOP6B,0,0.2,2015-06-15 08:32:35 UTC
3M67TQBQQHOB9MYQG7MTKCURSAL9AW,593,4,Very inteesting use of not only funding but using a fan base to receive input,635349146,A1V6P1ZE6Q8YEW,0,A2RD843ESYKRP2,1,A32QBXDPHHSTOD,0,A3HW4QDJB63OQ2,0,A9K0CV70JWG1W,0,0.2,2015-06-15 08:21:59 UTC
38LRF35D5LW99TN8532AT03ZZL33UL,589,11,"Hi Alex, Weve decided that the delivery method for the nonphysical materials will be through an online course called Laser Tag Hardware and Software Design, which well give you access to. You can use this online course in various ways 1 You can download the schematics and ignore everything else. 2 You can use the courses help forum if you have questions. 3 You can actually take the course, if youre interested in learning about hardware andor software design. 4 You can enroll your children, friends, students, etc. in the course for free. Even after we ship the hardware to the backers, our plan is to keep the course up to date and to add material based on your feedback. Thanks, Stephen",629029773,A1PE0077HI218F,1,A1T79J0XQXDDGC,0,A1ZFUBB7KVAT4G,0,A3HW4QDJB63OQ2,0,A9K0CV70JWG1W,0,0.2,2015-06-15 07:57:40 UTC
3UUSLRKAUL35TAD9LKFBWHBRINT7DJ,87,43,"It seems like many elements of this system are about future proofing. I look forward to what the future brings. I have a 40W laser cutting table. It does seem to be a huge system for a laser. I dont know how it will work for hyrel just yet, but I trust that they will be creative. Also, Craig  Missed your input. I look forward to the expertise you can bring to this.",86514727,A1T79J0XQXDDGC,1,A1V6P1ZE6Q8YEW,0,A9K0CV70JWG1W,0,ANMWPCK7TJMZ8,-1,AQR70X1KIOP6B,1,0.2,2015-06-15 08:38:36 UTC
36818Z1KV3DPUK9AZYLJTZR5SIA3A8,320,627,Jon Im also from Canada. It tells me the large flat rate box is 55. Not sure if the 10x10 upgraded Little Monster I ordered will still fit though.,338685250,A1PE0077HI218F,1,A1V6P1ZE6Q8YEW,0,A3Q92WMGIHEPSD,0,A9K0CV70JWG1W,0,ANMWPCK7TJMZ8,0,0.2,2015-06-15 08:32:47 UTC
37SDSEDIN92F1T2GFWNM9F6D4AW81H,505,17,"Hi Jimmy, we have been in contact with the shipping company we used to help us send out the final batch and they let us know that it can take a few weeks for the shipments to arrive. Your package was mailed on 1224, so it could be another week or two. I hope it arrives sooner than that! Thanks.",528483970,A1V6P1ZE6Q8YEW,0,A2RD843ESYKRP2,0,A3HW4QDJB63OQ2,1,A9K0CV70JWG1W,0,AQR70X1KIOP6B,0,0.2,2015-06-15 08:12:24 UTC
311HQEI8RSG8WBI5D248N9UU6537ZI,704,21,"also, on a full charge capacity for pronto 5, how many times can I charge iphone 5s before the pronto 5 is empty thank you.",769299885,A1PE0077HI218F,1,A1V6P1ZE6Q8YEW,0,A32QBXDPHHSTOD,0,A9K0CV70JWG1W,0,AQR70X1KIOP6B,0,0.2,2015-06-15 07:57:01 UTC
39O6Z4JLX2XL26JMUIJ3W2UMKNBXV2,513,38,"Is anyone able to track their shipment  I got the notice with the tracking number but all it says when tracked is  PreShipment Info Sent to USPS  , That is dated Nov.23, I received the email Nov.22. !!!",536272143,A1PE0077HI218F,1,A9K0CV70JWG1W,0,AKJ8CNFZH73K6,0,AQR70X1KIOP6B,0,AXMPSUNKUBEIL,0,0.2,2015-06-15 08:30:28 UTC
3BA7SXOG1JQ3UY1XDQ21F6OQ88QR8W,302,10,You can take a look at the update about additional funding. httpswww.kickstarter.comprojectsdistriqtgameservicesairnativeextensionposts905180 The more funding we can raise the more work well put into the extension.,319580535,A1T79J0XQXDDGC,0,A1V6P1ZE6Q8YEW,0,A32QBXDPHHSTOD,0,A3HW4QDJB63OQ2,1,A9K0CV70JWG1W,0,0.2,2015-06-15 08:34:18 UTC
3UY4PIS8QRL040PKLYC5RCW8T5VN1K,17,13,Hi Mattias. Sorry to hear that! We will check up on it first thing Monday and make sure you get your wind meter. Thanks a lot for your patience!!,16600563,A1T79J0XQXDDGC,0,A1V6P1ZE6Q8YEW,0,A1ZFUBB7KVAT4G,1,A9K0CV70JWG1W,0,AQR70X1KIOP6B,0,0.2,2015-06-15 08:19:37 UTC
3ZUE82NE0A16R8WOMV27YHA75KF8FI,324,689,"Just a reminder to NAB participants that Turbo Aces California Showroom is an easy stop over point after Vegas. This will be a good opportunity to visit our facility to meet the AllSteady7 development staff in person and see our full product line located at 2140 W. Chapman, 230 in the City of Orange. The AllSteady7 will be set up for live demo and lunch is on us ",343615064,A1T79J0XQXDDGC,0,A1V6P1ZE6Q8YEW,0,A2RD843ESYKRP2,1,A9K0CV70JWG1W,0,ANMWPCK7TJMZ8,0,0.2,2015-06-15 08:26:42 UTC
359AP8GAGGKVOI7VLOK0CBT9XNIC7P,385,222,Will Ghost have an API for clients to interact with it Im mainly thinking for mobile apps. Or are you going to stick with the mobile web for now.,404009803,A1PE0077HI218F,1,A1V6P1ZE6Q8YEW,0,A291KO368YRYCR,0,A3HW4QDJB63OQ2,0,A9K0CV70JWG1W,0,0.2,2015-06-15 08:32:56 UTC
309D674SHZLIQUALY5WGHDF5GD8BC9,389,50,"ccatks Thank you for the interest in our project and tutorials. We have, as you might have noticed, already made quite a comprehensive Kalman guide with all the mathematical aspects to it httpblog.tkjelectronics.dk201209apracticalapproachtokalmanfilterandhowtoimplementit We might be doing a similar guide for the PID controller when the Kickstarter is over.",407013506,A1V6P1ZE6Q8YEW,0,A1ZFUBB7KVAT4G,1,A3HW4QDJB63OQ2,0,A9K0CV70JWG1W,0,AKJ8CNFZH73K6,0,0.2,2015-06-15 08:55:48 UTC
3HUR21WDDUP260ERZT6N31YG24EYXD,555,39,"When we will have a confirmation of the projet, i want to build my printer!",587162688,A1T79J0XQXDDGC,0,A1V6P1ZE6Q8YEW,0,A32QBXDPHHSTOD,1,A9K0CV70JWG1W,0,AQR70X1KIOP6B,0,0.2,2015-06-15 07:56:17 UTC
38O9DZ0A62NZM01O5LQ2UKKRQLK62A,366,16,I think I found it on my own. At my funding level when will I see all my available templates Thanks.,384954719,A1PE0077HI218F,0,A1T79J0XQXDDGC,0,A3HW4QDJB63OQ2,1,A3Q92WMGIHEPSD,0,A9K0CV70JWG1W,0,0.2,2015-06-15 08:33:25 UTC
3UQVX1UPFSH48PF93WALLJA0DIZ206,364,7,"Carrie, the bobbins hold about 6 oz. Thanks for the support Ann!",383972430,A1PE0077HI218F,0,A1T79J0XQXDDGC,0,A1V6P1ZE6Q8YEW,0,A9K0CV70JWG1W,1,ANMWPCK7TJMZ8,0,0.2,2015-06-15 08:35:53 UTC
3CVDZS288H0LCXYSGWCQ3ZB2PP4FMD,111,59,"Maybe down the track, you could think of make a garden light version, charges all day, runs all night and have snap on coloured filers for effects, hate the rechargeable battery types, they always die in no time at all and are not waterproof, just thinking.... ",110790680,A1PE0077HI218F,1,A1T79J0XQXDDGC,0,A32QBXDPHHSTOD,0,A3HW4QDJB63OQ2,0,A9K0CV70JWG1W,0,0.2,2015-06-15 08:33:31 UTC
3PKVGQTFIHKI94SFQU0VEJCS1NSRY9,124,9,less than a week  httpwww.kickstarter.comprojects1369857650realpythonforwebdevelopmentfeaturingweb2pyposts,122605684,A1PE0077HI218F,1,A1V6P1ZE6Q8YEW,0,A32QBXDPHHSTOD,0,A9K0CV70JWG1W,0,AQR70X1KIOP6B,0,0.2,2015-06-15 08:36:27 UTC
3ZURAPD288NOG8C3NATSJ7NZREA1FS,486,58,"Which one to get According to the instruction provided, Bose QC 25 should choose 3.5mm model, and Bose AE2i should choose 2.5mm model. I have both headphones, and I found they actually use the same size cable plug, I can use my QC 25 cable with AE2i, so Im bit confused. Please advise. Thanks.",513006196,A1PE0077HI218F,1,A2RD843ESYKRP2,0,A3HW4QDJB63OQ2,0,AKJ8CNFZH73K6,0,AXMPSUNKUBEIL,0,0.2,2015-06-15 08:34:11 UTC
3E9ZFLPWOYSGG0ZMVBKKHD4SCLGIXR,261,414,Any news on shipping Estimated delivery was in July 2014..,272279304,A1PE0077HI218F,1,A1ZFUBB7KVAT4G,0,A3HW4QDJB63OQ2,0,A3Q92WMGIHEPSD,0,AQR70X1KIOP6B,0,0.2,2015-06-15 08:36:33 UTC
39HYCOOPKOLOEDKWPQH0FZ8HDCODM0,475,4685,Regarding the hot air balloon the first thought I had was you would have to be very brave to toss launch from a hot air balloon haha,499322084,A1V6P1ZE6Q8YEW,0,A32QBXDPHHSTOD,0,A3KOVCQYR8K3HY,1,A9K0CV70JWG1W,0,AKJ8CNFZH73K6,0,0.2,2015-06-15 07:45:10 UTC
3NQUW096N68S55PUDYBJTQA2MMK9LE,378,200,So I received my Goccia last night. Activation took about 56 tries. Charging prior to that took about 30 mins. I didnt really start using it until this morning at 630am EST and just did my first sync. It actually synced on the first try. Im not sure exactly how accurate the information the app has shown but it seemed to work. I have an iPhone 5 with the latest updated app. And no I never received a shipping notification either so luckily I was home when it was delivered.,398552139,A1PE0077HI218F,1,A1T79J0XQXDDGC,0,A1V6P1ZE6Q8YEW,0,A3HW4QDJB63OQ2,0,A9K0CV70JWG1W,0,0.2,2015-06-15 08:19:41 UTC
3L7SUC0TTUUUFTJ2DET50SOYJNF0MU,549,141,"Hi Keith, well post a project update this month for sure. In the meantime, were working on external boot on Mac hardware.",577440097,A1PE0077HI218F,1,A1T79J0XQXDDGC,0,A1V6P1ZE6Q8YEW,0,A3UWM3KJYEL5XU,0,AQR70X1KIOP6B,0,0.2,2015-06-15 08:38:16 UTC
3566S7OX5DJB1FXX5RVGVFAITQR17O,406,12,Thanks for the prompt reply... Currently in India filming Tigers and having checked in and and flown with a DJI Ronin the BW05 cant come soon enough  the box alone seems like it will weigh more than your entire kit! We would usually use the Nikkor 1635mm on a gimbal or the new Nikon 20mm prime with a D750 or D810  hopefully those will be OK. They are also one of our clients so keen to be able to use it to fly Nikons as we shoot all of their videos with their cameras  Good luck with the project  we are telling all we know about it.,422937531,A1PE0077HI218F,0,A1V6P1ZE6Q8YEW,0,A3HW4QDJB63OQ2,1,A3KOVCQYR8K3HY,0,A9K0CV70JWG1W,0,0.2,2015-06-15 08:31:42 UTC
3FI30CQHVKJTAD1KOEJDVDNVKRXB6H,301,50," 1 pitch and mod wheels. I also hope some careful thought will be given to keeping the keyboard mechanism as quiet as possible. I still love my VAX 77 and play it daily, but have always wished the keys were a little quieter. While certainly not the number 1 concern, I just hope it stays on the radar. Thanks",319258428,A1V6P1ZE6Q8YEW,0,A291KO368YRYCR,0,A3Q92WMGIHEPSD,1,A9K0CV70JWG1W,0,AQR70X1KIOP6B,0,0.2,2015-06-15 08:11:34 UTC
3R4QIDVOJPCVUV6J4N4189LT4MXEE4,869,16,"Just to clarify, will I be able to use Maid to cook frozen foods like pizza since there are no buttons to set the temperature and time. I want this oven to replace my Breville oventoaster.",928992223,A1V6P1ZE6Q8YEW,0,A291KO368YRYCR,0,A32QBXDPHHSTOD,1,A3HW4QDJB63OQ2,0,A9K0CV70JWG1W,0,0.2,2015-06-15 08:21:29 UTC
3M0556243SKRUFJSSXRQGE02UFEFND,929,26,"I would like to say within a week or so, we have a new shipment of spheres on the way in, and we have to tack the nuts down. If you wish I can start preorders on them.",1003946946,A1T79J0XQXDDGC,0,A1V6P1ZE6Q8YEW,0,A32QBXDPHHSTOD,0,A3CFNUD7VR2E1E,0,A3UWM3KJYEL5XU,1,0.2,2015-06-15 08:38:32 UTC
335VBRURDJ0EZZF2WCOFGVKIDPJ9ER,255,2,"Hi Skeam, That message means there are 1 or 2 things happening, 1 The music on your device may have DRM Digital Rights Management or 2 You may be using iTunes match. Unfortunately, for DRM content there is nothing we can do. RondoPlayer isnt allowed access to the audio content. For iTunes match songs, you can use the Apple Music player to download the songs locally and then RondoPlayer will be able to play them. Unfortunately, Apple prevents direct access to iTunes match content. We will support iTunes match as soon as Apple opens it up to developers if ever. If you are a Spotify subscriber, youll be happy to know RondoPlayer for Spotify is being submitted to the App Store by the end of the week. We are also working on a OSX version of RondoPlayer which will work with RondoMotion if you have a Mac that supports Bluetooth Low Energy.",267354327,A1PE0077HI218F,1,A1T79J0XQXDDGC,0,A1V6P1ZE6Q8YEW,0,A3HW4QDJB63OQ2,0,A9K0CV70JWG1W,0,0.2,2015-06-15 08:38:49 UTC
3HEM8MA6H9COOPLEMSFCW29B1WOPQD,5,51,"In my previous comment, I think I found the answer to be yesthe Repetier Host imports an AMF. Thanks!",5649635,A1T79J0XQXDDGC,0,A1V6P1ZE6Q8YEW,0,A3HW4QDJB63OQ2,0,A9K0CV70JWG1W,0,AXMPSUNKUBEIL,1,0.2,2015-06-15 08:08:17 UTC
3WA2XVDZEMHRHGD4Y5L3WLTGNOAE6K,281,395,Tim Roxas you are 65 funded now in less than 24 hrs...how about some stretchgoals,297790642,A1PE0077HI218F,0,A1T79J0XQXDDGC,0,A1V6P1ZE6Q8YEW,0,A1ZFUBB7KVAT4G,1,A9K0CV70JWG1W,0,0.2,2015-06-15 08:37:56 UTC
3NI0WFPPI9GSQQYAQYMOBWRCTN060Q,322,20,"Patrick Slivovic  Using the Pebble with a paired Android or iOS smartphone you will be able to download the third party watchface like those of the PebbUp project using the smartphones web browser, then using the official Android or iOS Pebble app you can then install the watchface download on the paired Pebble.",341301528,A1PE0077HI218F,1,A1T79J0XQXDDGC,0,A1V6P1ZE6Q8YEW,0,AKJ8CNFZH73K6,0,AQR70X1KIOP6B,0,0.2,2015-06-15 08:37:26 UTC
3I01FDIL6M8Y79G3F8YG0QUJ777D29,943,155,"Hi Jorge, Thanks for your question. Heres our answers 1 Unfortunately Hulu will not work for you with SurfEasy at launch. It works with other video and music streaming sites but because of how Hulu uses Flash it is very difficult to control how it connects to the internet through the browser. We are working on a solution for this  but I dont have an estimated delivery time for you right now. If hulu specificly is your primary use you might want to wait until we get that feature working. 2 We will allow video through the servers. 3 Kickstarters will receive unlimited bandwidth as long as they own their SurfEasy key. When we launch the product commercially there will be a service fee tied to bandwidth. We will treat kickstarters the same as post launch customers in terms of bandwidth  no artificial throttling and that type of stuff. Terms and conditions are in the works  if when you get them youre not happy with anything weve done please tell us and if we cant work something out well refund your pledge. thanks Chris",1016549487,A1PE0077HI218F,1,A2RD843ESYKRP2,0,A3HW4QDJB63OQ2,0,A9K0CV70JWG1W,0,AXMPSUNKUBEIL,0,0.2,2015-06-15 07:54:41 UTC
389A2A304OIH677B0PZRXWJMP9CC0P,262,670,David Erickson I think the plan is to release the protocol documentation. The Kodi Addon will be open source. The HDHomeRun apps will not be. 10 UI  yes. Figure it will work well on a 97 projector screen at 17,274418509,A1PE0077HI218F,1,A1T79J0XQXDDGC,0,A291KO368YRYCR,0,A3HW4QDJB63OQ2,0,A3Q92WMGIHEPSD,0,0.2,2015-06-15 08:33:40 UTC
3P6ENY9P79WJUAZ7Q72YERGYOVXIHY,690,60,"Maybe offer a blank button set where we can write in function names for alternative firmware button mappings I realize thats another mold or create, but it opens things up for ANY software outside of the 2 main choices. I will definitely be keeping my earlybird units with one as LinuxCNC and one as Mach 3....but eventually would like to add another generic unit that I can write in the buttons and flash my own firmware on...whether its an addon during the campaign or something you can offer after KS has wound down.  Thanks again!",758825772,A1T79J0XQXDDGC,0,A1V6P1ZE6Q8YEW,0,A291KO368YRYCR,1,A9K0CV70JWG1W,0,ANMWPCK7TJMZ8,0,0.2,2015-06-15 08:30:22 UTC
31S7M7DAGGQBPKY8B4G0KQBEGTMTLX,243,16,Vocs tem moderao,258183443,A1PE0077HI218F,1,A291KO368YRYCR,0,A3HW4QDJB63OQ2,0,A3Q92WMGIHEPSD,0,A9K0CV70JWG1W,0,0.2,2015-06-15 08:27:38 UTC
337F8MIIMZDEB3UW7AT9EY7YXWV404,277,1622," The Atlantic reports that Russia has mobilized a vast troll army to comment on popular websites on the Internet. Moscow is financing legions of proRussia Internet commenters. The Guardian reported last year that the anonymity provided by, for example, Tor, makes it impossible for the NSA to know who the user is, or whether or not the user is in the US. Still others have commented on the possibility of hidden agendas of some questioners, wondering if they have an aim similar to those who engage in intrusion and hacking. Im confused by what Steve is trying to infer here. Its quite clear if you search my history that I am not involved with Russia. Im a freelance security researcher. The same is true of Rajan  he seems to have good internet provenance. And I dont know if Werner Almesberger is the Werner Almesberger that I know of outside Kickstarter, but hes pretty well known.",291408440,A1PE0077HI218F,1,A1T79J0XQXDDGC,0,A1V6P1ZE6Q8YEW,0,A3UWM3KJYEL5XU,0,AQR70X1KIOP6B,0,0.2,2015-06-15 08:42:13 UTC
3CRWSLD91K4FIABLFZVGQTKGHQUMO5,842,0,Ive now replied to your message.,902214802,A18JA2145UWXG,0,A1T79J0XQXDDGC,0,A1V6P1ZE6Q8YEW,1,A9K0CV70JWG1W,0,AXMPSUNKUBEIL,0,0.2,2015-06-15 07:29:13 UTC
3IQ9O0AYW6Z9ZJQ2Q1JNSAJMZPSTIJ,795,13,Ive given up on this project and dont care if it comes out or not. I will no longer buy anything from them anymore. I wish they would just communicate more even if its just little details we deserve that much.,858136225,A1PE0077HI218F,1,A1V6P1ZE6Q8YEW,-1,A3UWM3KJYEL5XU,1,A9K0CV70JWG1W,0,AKJ8CNFZH73K6,0,0.2,2015-06-15 08:42:17 UTC
3SX4X51T809EG92WIW5BH2PGN96OAO,381,39,"No support for Android at launch, but definitely in the future!",401341978,A1PE0077HI218F,1,A1T79J0XQXDDGC,0,A1V6P1ZE6Q8YEW,0,A3HW4QDJB63OQ2,0,A3UWM3KJYEL5XU,0,0.2,2015-06-15 08:40:58 UTC
31GN6YMHLPSQLEXSQIICJWW8CHCSW0,602,20,"Where are all the people Last time when we were together at the maker fair, I though we have more than 30 guys shown interests buying one. Where are those guys This little Bieree should really caught more attention.",644554319,A18JA2145UWXG,0,A1T79J0XQXDDGC,0,A32QBXDPHHSTOD,0,A9K0CV70JWG1W,0,AQR70X1KIOP6B,1,0.2,2015-06-15 07:58:28 UTC
3MIVREZQVHYNDYOY90A40LNC7MIKQ7,80,43,Great. Is it possible to add additional 5  to my existing pledge to receive a TopHat when there is no TopHat included in the pledge level,78732662,A1V6P1ZE6Q8YEW,0,A32QBXDPHHSTOD,1,A3HW4QDJB63OQ2,0,A9K0CV70JWG1W,1,AQR70X1KIOP6B,-1,0.2,2015-06-15 08:15:20 UTC
34OWYT6U3WHQF4HOSVE61AIA5IQ9I0,326,32,Is this where we are supposed to post for the purple Ringo I sent a message to Plum Geek through KS.,344732214,A1PE0077HI218F,1,A1V6P1ZE6Q8YEW,0,A3HW4QDJB63OQ2,0,A3UWM3KJYEL5XU,0,A9K0CV70JWG1W,0,0.2,2015-06-15 08:37:02 UTC
3Z8UJEJOCZDBP1Z57S7JX4GLM0S39T,307,38,"With regards to Shauns question regarding an enclosure, what about an enclosure to protect from the environment such as drafts, dust, other vapors, etc... and a filter to protect the operators against fumes and dust from the melting plastic so the printer is more health friendly in lesser ventilated indoor rooms Thanks.",322099102,A1PE0077HI218F,1,A1V6P1ZE6Q8YEW,0,A1ZFUBB7KVAT4G,0,A3CFNUD7VR2E1E,0,A3HW4QDJB63OQ2,0,0.2,2015-06-15 08:57:50 UTC
