HITID,index,comment_index,comments,keys,Worker1,Answer1,Worker2,Answer2,Worker3,Answer3,Worker4,Answer4,Worker5,Answer5,Avg,Date
35F6NGNVM8JCAZ967AFQ1LTDL9HT7O,701,16,Here too. Where is the trax final May is allmost over...,767897310,A1T79J0XQXDDGC,0,A1V6P1ZE6Q8YEW,0,A1ZFUBB7KVAT4G,0,ANMWPCK7TJMZ8,0,AQR70X1KIOP6B,0,0,2015-06-15 08:27:59 UTC
3OEWW2KGQJBCEG5826WD73XM8C3ODQ,390,3,Kris Ranes Sorry we dont have data for 3D printing.,407217109,A1PE0077HI218F,0,A1T79J0XQXDDGC,0,A1V6P1ZE6Q8YEW,0,A3HW4QDJB63OQ2,0,A9K0CV70JWG1W,0,0,2015-06-15 08:37:34 UTC
3I6NF2WGIGWTIQ9HZH1M4I0S49EG5N,688,49,How easy is it going to be to link it to my PC sorry complete novice here. Do I need to buy a MIDI card for my computer I want to be able to make electronic music with Phenol like you show in the video. Is this something an idiot like me can do,751441237,A1V6P1ZE6Q8YEW,0,A3HW4QDJB63OQ2,0,A9K0CV70JWG1W,0,ANMWPCK7TJMZ8,0,AXMPSUNKUBEIL,0,0,2015-06-15 07:40:20 UTC
359AP8GAGGKVOI7VLOK0CBT9XNH7CJ,894,31,"Hi Jason, probably early next year. Hi Michael, just let us know when you switch and we can change your case order.",960120967,A1T79J0XQXDDGC,0,A1V6P1ZE6Q8YEW,0,A32QBXDPHHSTOD,0,A9K0CV70JWG1W,0,AQR70X1KIOP6B,0,0,2015-06-15 08:05:42 UTC
3FCO4VKOZ4DALGR9HFQV2ZTCIZU7EC,928,164,"Hello, Is your product accurate enough Ive got a little difficult to understand how it works, but I hope it can be exactly enough.",1003481542,A1V6P1ZE6Q8YEW,0,A32QBXDPHHSTOD,0,A9K0CV70JWG1W,0,AKJ8CNFZH73K6,0,AXMPSUNKUBEIL,0,0,2015-06-15 07:55:27 UTC
363A7XIFV4M96TBTJ8RPCUJOJ23AVC,557,81,What are the stretch goals if any,589396633,A1T79J0XQXDDGC,0,A2RD843ESYKRP2,0,A32QBXDPHHSTOD,0,A3HW4QDJB63OQ2,0,A9K0CV70JWG1W,0,0,2015-06-15 07:50:03 UTC
341YLJU21IZFFKWP7MZRRNAWZCF2I0,408,16,httpgizmodo.comnikedesignersaysmartymcflyspowerlacesarecoming1523547123,425828491,A32QBXDPHHSTOD,0,A3HW4QDJB63OQ2,0,A3Q92WMGIHEPSD,0,A9K0CV70JWG1W,0,AKJ8CNFZH73K6,0,0,2015-06-15 08:01:10 UTC
39XCQ6V3KY4RLXKBN4S0SRN3AVB56A,169,14,"Whats the final licensing model If I pledge for a single VIPER Supporter, will I be able to use this on other Spark CoresPhotons I already have, or will I need to purchase for each one",185215327,A1T79J0XQXDDGC,0,A2RD843ESYKRP2,0,A3HW4QDJB63OQ2,0,A9K0CV70JWG1W,0,AXMPSUNKUBEIL,0,0,2015-06-15 08:22:35 UTC
3VDVA3ILIDFUU88YYUZA1SNBST9G15,452,55,"Ikawa Regarding Chriss question of roasting in smaller batch, I think it can be done in the app, by letting people create roast profile of different batch size. Even better, allow other users to rate and comment on others roast recipe.",471055882,A1T79J0XQXDDGC,0,A32QBXDPHHSTOD,0,A3Q92WMGIHEPSD,0,A9K0CV70JWG1W,0,AKJ8CNFZH73K6,0,0,2015-06-15 08:01:01 UTC
3UQVX1UPFSH48PF93WALLJA0DIY205,72,3,"Everyone Q Anyone able to share where they have been successful in locating suppliers of the PLA, ABS and other types of pellets needed as raw materials, or empty spools to wind the output onto Id like to line up some suppliers for myself before my unit ships to me in Canada. Im going to start looking for local companies that might be using a lot of filament, to see if I can acquire their empty spools. Im also going to comb for any suppliers who might be recycling plastics in my area to see what quality purity of raw pellets they produce, and their pricing.",67069836,A1V6P1ZE6Q8YEW,0,A1ZFUBB7KVAT4G,0,A2RD843ESYKRP2,0,A3HW4QDJB63OQ2,0,A9K0CV70JWG1W,0,0,2015-06-15 08:02:50 UTC
3IKMEYR0LWV6LFMD7PK343P9RG42KB,647,1,Has conductak been sent out yet Thanks.,701256344,A1T79J0XQXDDGC,0,A1V6P1ZE6Q8YEW,0,A3HW4QDJB63OQ2,0,A9K0CV70JWG1W,0,ANMWPCK7TJMZ8,0,0,2015-06-15 08:12:42 UTC
3DA79LNS59VU9G8J5YC0O4HXG7W3TU,565,46,Regarding the Wak app Its just like a regular alarm clock app that works even when underneath the lock screen.,597492517,A1T79J0XQXDDGC,0,A291KO368YRYCR,0,AKJ8CNFZH73K6,0,AQR70X1KIOP6B,0,AXMPSUNKUBEIL,0,0,2015-06-15 07:59:17 UTC
33IXYHIZB5I3ZFU3B39068C47J82ER,984,23,"YoBox labels are made to be selfadhesive. For durability and security reasons, they are not designed to be reusable like PostIt. You can certainly peel off the label from an existing box to reuse them, so long as the NFC RFID andor QR code are not destroyed in the process. Alternatively, you can cut off the entire side of the box with the YoBox label on it and tape that to a new box. However, thats not something we would recommend.",1058069720,A1V6P1ZE6Q8YEW,0,A1ZFUBB7KVAT4G,0,A3HW4QDJB63OQ2,0,A9K0CV70JWG1W,0,AQR70X1KIOP6B,0,0,2015-06-15 08:05:59 UTC
3VGZ74AYTGGEHBIWEROUIO62WQ0GCV,743,676,Will Remee ship earlier than July since it was funded so quickly,817181187,A1T79J0XQXDDGC,0,A1ZFUBB7KVAT4G,0,A291KO368YRYCR,0,A32QBXDPHHSTOD,0,A3HW4QDJB63OQ2,0,0,2015-06-15 08:10:15 UTC
34O39PNDK68MWWZ4G2MB68ERGEBRBV,319,39,Hi GeorgeBogdan I presume from the below comment that youve now posted the single board pledges. I just wondered when Youll be doing the 5 board pledges regards Phil C.,335060498,A1T79J0XQXDDGC,0,A1V6P1ZE6Q8YEW,0,A3HW4QDJB63OQ2,0,A9K0CV70JWG1W,0,AKJ8CNFZH73K6,0,0,2015-06-15 08:18:08 UTC
371QPA24C2OYZDU4IUYH0B20INHT1R,447,91,"Hi Jared, shipping is the same no matter where you are located. All USB Meter Pro rewards will be sent out from China. I apologise for the confusion with postage costs.",467724877,A18JA2145UWXG,0,A1T79J0XQXDDGC,0,A32QBXDPHHSTOD,0,AKJ8CNFZH73K6,0,AQR70X1KIOP6B,0,0,2015-06-15 07:45:28 UTC
3L21G7IH47WUGZTYS0LG8SUFXPZY1L,892,12,Lawrence youll have to hit manage pledge and up the dollar amount by 35 or create a second Kickstarter account. Then get with Pete at the end so he knows which rewards youd like. Unfortunately KS doesnt handle multiple pledges by one person very well.,957272836,A32QBXDPHHSTOD,0,A3HW4QDJB63OQ2,0,A3Q92WMGIHEPSD,0,A9K0CV70JWG1W,0,AXMPSUNKUBEIL,0,0,2015-06-15 08:02:00 UTC
3VADEH0UHCX0150REW4HR2OCJK9SP5,133,10,Can Throwaway make it in the final furlong,130710438,A16U1L4R6WV5G2,0,A32QBXDPHHSTOD,0,A9K0CV70JWG1W,0,ANMWPCK7TJMZ8,0,AXMPSUNKUBEIL,0,0,2015-06-15 07:27:35 UTC
3Z3R5YC0P3NPPSOCPTD2PD6UJX0TFS,559,322,Mark Interesting question. Not the same strand of hair but from the same person. We cut strands of hair from our system engineer and we found that human body has an unbelievable quality control on the diameter of hair. The diameter of his hair is about 80 microns.,590488422,A1V6P1ZE6Q8YEW,0,A1ZFUBB7KVAT4G,0,A9K0CV70JWG1W,0,AQR70X1KIOP6B,0,AXMPSUNKUBEIL,0,0,2015-06-15 07:49:04 UTC
34KYK9TV2R8YXBZHVRMGWIJN2GTSBJ,652,9,launch it,707260502,A16U1L4R6WV5G2,0,A1V6P1ZE6Q8YEW,0,A1ZFUBB7KVAT4G,0,A3CFNUD7VR2E1E,0,A3HW4QDJB63OQ2,0,0,2015-06-15 08:24:08 UTC
38XPGNCKHT0U44VCA7HYZRXORS74VV,70,58,Updates I really would like to my my kit before Halloween.,65597458,A1PE0077HI218F,0,A32QBXDPHHSTOD,-1,A3HW4QDJB63OQ2,1,A3Q92WMGIHEPSD,0,A9K0CV70JWG1W,0,0,2015-06-15 08:38:59 UTC
3UEBBGULPFO4P531PY3CU9SW2B7FU5,188,12,Is everything on schedule How are things going,205868039,A18JA2145UWXG,0,A1ZFUBB7KVAT4G,0,A3HW4QDJB63OQ2,0,AKJ8CNFZH73K6,0,AQR70X1KIOP6B,0,0,2015-06-15 08:38:26 UTC
38RHULDV9YF1R0UWL6OYFUQL3JAWIC,335,93,Ok I added 99 to add 3 sensor pack to hub3 sensor combo. Should be enough to cover my parents place,350259914,A1T79J0XQXDDGC,0,A1V6P1ZE6Q8YEW,0,A32QBXDPHHSTOD,0,A3KOVCQYR8K3HY,0,A9K0CV70JWG1W,0,0,2015-06-15 08:31:06 UTC
3NZ1E5QA6Z1XR916JV98379VOWM5BV,624,0,Update Please!,677577144,A1V6P1ZE6Q8YEW,0,A32QBXDPHHSTOD,0,A9K0CV70JWG1W,0,AKJ8CNFZH73K6,0,AXMPSUNKUBEIL,0,0,2015-06-15 08:20:41 UTC
3VMHWJRYHVGW69XWU3EZEGR0WTNXFE,145,3,"QuestionsSuggestions 1. Amazon  I believe that like many products that claim to be great which being optimistic I believe yours will be it really isnt known for sure until you check the Amazon reviews. Do you plan on setting up shop like many other KS creators and using that as a platform to market this as well as future products and accessories to the masses because again assuming all goes well with this Ill be sure to write a review. Also considering US backers use Amazon to checkout on KS thus indicating they have an account, establishing yourself there would be a good idea, no Another reason is because as Im sure like other backers so many products nowadays want us to sign up for another site that avoiding to have to remember another username and password would be greatly appreciated. 2. Official Return Policy andor Warranty Manufacturers or otherwise  Could you specify in detail exactly what your warranty covers and what it does not as well as outline your return policy if any also going into detail of the processes involved in both cases ex we pay for shipping back or you do etc..., thanks. 3. Material  So this is made out of what material exactly and please dont say metal, a detailed a response as possible is ideal even where sourced from would be helpful. ATTRACT BACKERS 4. Early Bird adopter Specials  KS backers kill for them, and depending on what your budget would allow for because then if done even better some campaigns introduce or actually start with Super Early Bird offers than Early than Midday KS offer below retail. Some add names unique to their own campaign, such as early thiefs idk seeing how their getting in before the you get the idea. FILL YOUR PAGE 5. Stretch Goals  Too late now of course but for future projects Id recommend featuring accolades as well as stretch goals more prominently so as to let potential backers know how well you are already doing andor with plans on a improved product or benefits to compel them to jump on board despite some of the better perks being eaten up already. Ex This project is Dragon Certified which no doubt not for this project but for next perhaps assuming this is successful andor featured in articles on Engadget for example. Considering you dont have the accolades featured obviously Id consider especially since being closer to the finish line placing greater emphasis on the stretch goals. KEEP BACKERS 6. Updates  Will you continue to update your backers updates on current projects, future projects, others questions answered etc through KS comment section, update section, direct message andor email after campaign ends KS is ideal 7. ContactSupport  What are the different ways to contact you after the campaign ends Aside from a website In case of problems etc, it would be in your interest to keep communicating on KS not only with direct messages but comment section questions so that the community can see perhaps answers to questions they hadnt even thought of. Some companies have a number andor email as well. ATTRACT BACKERS 8. Sister Campaign  I suggest trying if you havent already to contact other projects with a similar focus to ultimately create a sister campaign with as others such as Yoropen has done with swivelCard as one example to try garner support from an additional channel though this being so late probably wont be for this campaign but next maybe. 9. Security  Is this device tamper proof from the outside or are their ways a would be thief with time could eliminate the purpose of this device or is it relatively unless they break the door solid in its concept ATTRACT BACKERS 10. ThunderClap  I believe this is a tool LinkMount By the way that is the perfect example of what a Kickstarter campaign is in almost every aspect so study it among others have used to garner support so please research it as well if you havent so you could use it to help. 11. IndieGoGo  I would recommend you be open if you will or have ever operated on another crowdfunding site because if found out many will begin to distrust you not mentioning earlier especially if no good answer is provided why you are relaunching here. 12. Future Discount  For your backers relative to other kickstarter projects some creators like those of the Blink campaign as just one example have made their backers if not generally which Id recommend at least for Earlybirds aware that they would have continued access to special promotions and discounts following the campaignwill you be offering anything similar for yours Like for your future projects like they have such as your v2 if you make one and accessories Also for upcoming releases will you also be contacting us early as well to put us on notice 13. Listing Image Update  Another GREAT way to further inform potential backers of info that might entice them to want to click on your listing such as other successful creators have done and you may have seen is update your main image with custom complimentary text updates within the main picture in addition to your already Staff pick add Listing ending in 3 days or 2 hours left or New stretch goals added or achievedunlocked or 85 accomlished or Earlybird offers dwindling or Additional Early bird offers now offered etcTrust me that will help. 14. Faulty Lock  How would you know if your device is faulty or defective in some way What signs to look out for other than clearly broken in pieces, loose parts noises etc 15. Privacy Policy and Backers Information  What exactly will you be doing with backers information Ex Giving it to 3rd parties or protecting it from them etc Also what is your privacy policy. 16. AddOns and Accessories  A carry bag for travel again that would be an idea for a stretch goal not now since your finished 17. Maintenance  Regarding proper care to maintain the ring for longevity, what would be recommended Special sprays, cleaners, updates, equipment in the form of tools, etcthose to use and avoid would be helpful I appreciate you taking the time to read all of these if you could and await your replies. This hopefully should help you.",149890531,A1T79J0XQXDDGC,0,A2RD843ESYKRP2,0,A3HW4QDJB63OQ2,0,A9K0CV70JWG1W,0,AQR70X1KIOP6B,0,0,2015-06-15 07:48:14 UTC
34F34TZU7WZBAVGVP4KR3OPWCR42JC,628,51,I was using a bench supply too  but those voltage regulators need capacitors. I never found the extended instructions.,679241427,A1T79J0XQXDDGC,0,A1V6P1ZE6Q8YEW,0,A32QBXDPHHSTOD,0,A9K0CV70JWG1W,0,AXMPSUNKUBEIL,0,0,2015-06-15 08:27:09 UTC
37MQ8Z1JQEW15KBUB4LUDB4KPVD2Y6,756,9,"Sorry, well do so this weekend. As a startup, we often get singlethreaded with work. Weve been traveling a lot the last two weeks. We were selected to participate in the CableLabs Innovation Showcase, which is a byinvitation event of the cable industry, held March 1113 in Orlando, FL.. Nine companies were selected to present new technology at the event and, to share a bit of good news with you, we received their award, based on voting by the participants Altia Systems has the Best New Idea in CableLabs Conference Poll, httpwww.businesswire.comnewshome20130312006050en. This week, Lars and Dan were at Enterprise Connect, again in Orlando, FL.",827469952,A1V6P1ZE6Q8YEW,0,A291KO368YRYCR,0,A3HW4QDJB63OQ2,0,A3UWM3KJYEL5XU,0,A9K0CV70JWG1W,0,0,2015-06-15 08:35:41 UTC
3FSEU3P2NR09C3GTCZ816NJVY0DRR7,75,19,"Hi Rob, Yes on Saturday I should be releasing that and other new updates Thanks Alex",71400780,A1T79J0XQXDDGC,0,A32QBXDPHHSTOD,0,A3HW4QDJB63OQ2,0,A9K0CV70JWG1W,0,AXMPSUNKUBEIL,0,0,2015-06-15 07:54:53 UTC
3UL5XDRDNCJEPB3ZGJPYC5JUGQ158W,993,9,"Daniel Moffat At the 40 pledge level you should have access to all three courses. No need to pay anything else. If you havent gotten the emails with the download link, please send us an email to info at real python.com and we will get you sorted out.",1065015889,A1T79J0XQXDDGC,0,A32QBXDPHHSTOD,0,A3KOVCQYR8K3HY,0,A3Q92WMGIHEPSD,0,A9K0CV70JWG1W,0,0,2015-06-15 08:04:42 UTC
3P4ZBJFX2V3HH9S6KYIDCXDTNRIFW4,403,368,"Diego, since the current version has no SD card, where did it get the gcode while it was flying If the gcode is already uploaded to the onboard memory, how big a file can it hold",420221380,A18JA2145UWXG,0,A1T79J0XQXDDGC,0,A1ZFUBB7KVAT4G,0,AKJ8CNFZH73K6,0,AQR70X1KIOP6B,0,0,2015-06-15 07:46:57 UTC
3D1UCPY6GG9BBWGV2015X8LA2UA839,532,230,"Will there be automatic email notification upon shipping, and will a tracking number be provided in the email",558482235,A1V6P1ZE6Q8YEW,0,A3KOVCQYR8K3HY,0,A3Q92WMGIHEPSD,0,AKJ8CNFZH73K6,0,AXMPSUNKUBEIL,0,0,2015-06-15 08:19:32 UTC
3GKAWYFRAPTUZGH9H69SW32CIHZDPW,504,40,Here is one that we have been playing with for the last few weeks RFduino GE G35 Christmas Lights by Matt Schoenholz  Microsoft It too can be found bottom of the page at httpwww.rfduino.comdocumentation.html Here is a direct link to the page we are hosing for it httpwww.rfduino.comg35.html The source for it is the same page.,528432655,A18JA2145UWXG,0,A1T79J0XQXDDGC,0,A9K0CV70JWG1W,0,AKJ8CNFZH73K6,0,AQR70X1KIOP6B,0,0,2015-06-15 07:52:48 UTC
335VBRURDJ0EZZF2WCOFGVKIDPIE9V,340,27,"Brian, Not sure what your question is, however I can tell you that we had tested the Galaxy S4 Active AtT and works fine however charge only to the max allow by the USB port. Most USB port we tried are at the 500mA mark, and the newer Macbook Pro up to 750mA. We have not tested the Note 3",360112706,A1T79J0XQXDDGC,0,A1V6P1ZE6Q8YEW,0,A3CFNUD7VR2E1E,0,A3HW4QDJB63OQ2,0,A9K0CV70JWG1W,0,0,2015-06-15 08:35:14 UTC
3AXFSPQOYQYVBPS7DZZYN7JLLV9FJ9,98,52,I also am not able to find an email to leave details of my dogs name and details. Name Keegan Herold Breed Border Collie In memorandum Aug 2013,97230960,A18JA2145UWXG,0,A1T79J0XQXDDGC,0,A1V6P1ZE6Q8YEW,0,A3KOVCQYR8K3HY,0,AXMPSUNKUBEIL,0,0,2015-06-15 07:42:31 UTC
3HXCEECSQMTRBVE60BU80MERA4CYZA,584,1,Hi Brian! Can you let us know when we need to submit our delivery details Mine have changed since I made the order. Thanks!,621336991,A32QBXDPHHSTOD,0,A3Q92WMGIHEPSD,0,A9K0CV70JWG1W,0,AKJ8CNFZH73K6,0,AXMPSUNKUBEIL,0,0,2015-06-15 07:59:29 UTC
3UQVX1UPFSH48PF93WALLJA0DIY023,158,5,Does the shield support connections to multiple devices simultaneously e.g. connected to iPhone 5 and iPad at the same time,173567306,A1T79J0XQXDDGC,0,A1V6P1ZE6Q8YEW,0,A1ZFUBB7KVAT4G,0,A3HW4QDJB63OQ2,0,AXMPSUNKUBEIL,0,0,2015-06-15 07:48:02 UTC
371DNNCG442GADEPHF7WFLP8WTNT8B,506,3,Hi Angus. Easton has told me that hes started shipping them. Im just waiting for documentation from him and photos and then Ill write an update.,528501177,A1T79J0XQXDDGC,0,A291KO368YRYCR,0,A9K0CV70JWG1W,0,AKJ8CNFZH73K6,0,AXMPSUNKUBEIL,0,0,2015-06-15 07:58:09 UTC
3D4BBDG7ZHWDNZ68JCHAZUHTSLWC3K,327,158,The power button is the silver Xbox ring of lights touch button in the middle of the casing top.. eject is a laser engraved touch button towards the left on the top panel..,346524993,A1PE0077HI218F,0,A1T79J0XQXDDGC,0,A1V6P1ZE6Q8YEW,0,A3KOVCQYR8K3HY,0,A9K0CV70JWG1W,0,0,2015-06-15 08:24:46 UTC
3NKW03WTLM7E8YIFYET7OWH7UTRQW9,748,1229,"Can you confirm that I will be able to print my own paper I have an application where I need to write on a single sheet of paper, not in a notebook.",821291938,A1V6P1ZE6Q8YEW,0,A3HW4QDJB63OQ2,0,A9K0CV70JWG1W,0,AKJ8CNFZH73K6,0,AXMPSUNKUBEIL,0,0,2015-06-15 08:19:40 UTC
382GHPVPHSRASVTTQXBSGW5508E34X,240,130,"Hi Duncan, thanks! To be frank, were not thrilled about random colors either  but shipping and logistics will make it very challenging for us to designate colors for each order. We will keep working on this and if its not costprohibitive, well find a better solution. But yes, we will absolutely have neutral colors, and a semitransparent grip as well.",253024693,A1PE0077HI218F,-1,A1T79J0XQXDDGC,0,A3CFNUD7VR2E1E,1,A9K0CV70JWG1W,0,AQR70X1KIOP6B,0,0,2015-06-15 08:33:23 UTC
3JTPR5MTZSCYKC50P8M12ASLBQV5KF,511,26,"Since I have recently been reading about MBTA Charlie cards expiring, will these rings have any type of expiration date to them",535998693,A1ZFUBB7KVAT4G,0,A2RD843ESYKRP2,0,A3HW4QDJB63OQ2,0,A9K0CV70JWG1W,0,AKJ8CNFZH73K6,0,0,2015-06-15 08:09:02 UTC
3X2YVV51PU4QRUYYDZ3SNV9ZMH01WQ,257,3,Jade and anyone else who hasnt received your Sidekick  please send us your address so we can ship you your device. If youve already sent us your mailing address you should have received your Sidekick by now.,269720949,A2RD843ESYKRP2,0,A32QBXDPHHSTOD,0,A3HW4QDJB63OQ2,0,A9K0CV70JWG1W,0,AQR70X1KIOP6B,0,0,2015-06-15 08:02:14 UTC
3JMQI2OLFZ5UWV5W1RW0SEXHI2YDN0,477,1510,Amazon.com serves scandinavia aswell,499497800,A1T79J0XQXDDGC,0,A1V6P1ZE6Q8YEW,0,A3HW4QDJB63OQ2,0,ANMWPCK7TJMZ8,0,AXMPSUNKUBEIL,0,0,2015-06-15 07:28:16 UTC
3CMIQF80GNQGEJ397WG3Q2IU6RZ6QP,289,26,"Just curious, where will you get the PCB printed",301546271,A1T79J0XQXDDGC,0,A1V6P1ZE6Q8YEW,0,A32QBXDPHHSTOD,0,A9K0CV70JWG1W,0,AQR70X1KIOP6B,0,0,2015-06-15 08:35:45 UTC
39AYGO6AFFKVBMQHR4OMM8NP1GBN6I,880,867,Just in case anyones interested  Dabs are selling WD 6TB Green SATA 6Gbs 64MB 3.5 Hard Drives for 184.99 at the moment usually sold at over 200 Please note  These WILL NOT fit in a Slice....,942353248,A1T79J0XQXDDGC,0,A1V6P1ZE6Q8YEW,0,A32QBXDPHHSTOD,0,A3HW4QDJB63OQ2,0,A9K0CV70JWG1W,0,0,2015-06-15 08:09:40 UTC
3P458N04Q1HC5FLK68ZSUXXBNPIX2U,8,7,Is it possible to get both a snowflake and valentines day card if i pledge more,6734760,A1V6P1ZE6Q8YEW,0,A3KOVCQYR8K3HY,0,A9K0CV70JWG1W,0,ANMWPCK7TJMZ8,0,AXMPSUNKUBEIL,0,0,2015-06-15 07:43:52 UTC
3ICOHX7ENCBW35RPWG5MNKJPALO0E5,662,14,"Hi guys, BRCK arrived but there was no charger in the box. Please advise. Thanks!",716640500,A1PE0077HI218F,1,A1V6P1ZE6Q8YEW,0,A32QBXDPHHSTOD,0,A9K0CV70JWG1W,0,AQR70X1KIOP6B,-1,0,2015-06-15 08:33:53 UTC
3JAOYN9IHL2PAZAPQJ696RDZM8I33C,221,2,Do anyone know how to fix the WakaWaka power when it stop working Is there a website on how to fix it,239599173,A1T79J0XQXDDGC,0,A1V6P1ZE6Q8YEW,0,A32QBXDPHHSTOD,0,AN6WT1D6EQ8V5,0,AQR70X1KIOP6B,0,0,2015-06-15 09:54:42 UTC
3J94SKDEKIPQ66ZQXR0EYXXVRHYD5A,155,27,"I dont think that repair is possible. Super glue and similar products leave a residue around the bond with would impair the lens. I will send a replacement and mark it as a free item for customs, which I believe is the truth as it is a replacement part",171491069,A1PE0077HI218F,0,A1T79J0XQXDDGC,-1,A1V6P1ZE6Q8YEW,0,A3KOVCQYR8K3HY,1,AKJ8CNFZH73K6,0,0,2015-06-15 08:34:00 UTC
3Y40HMYLL1ILPRUMPS9Y0GS36G2UXA,461,6,"Peter, I normally open the door around there too. Until I get the thermocouple routed through the back I have to be careful opening the door. I could accidentally move a component, with the thermocouple, while the solder is still liquid. When I ran the fan full speed during the soak stages I was seeing a 6 degree difference in temp from left side to right side. With the fan staggered the difference was less than a degree. Running the fan full on when the heaters are full on helps eliminate hot spots. I used one of these httpwww.ebay.comitm400542887700 To measure temperature differential T1  T2 in various places of the oven. Shawn",480109934,A1T79J0XQXDDGC,0,A1ZFUBB7KVAT4G,0,A9K0CV70JWG1W,0,AKJ8CNFZH73K6,0,AXMPSUNKUBEIL,0,0,2015-06-15 07:37:41 UTC
391FPZIE4CMO31U7KORCXU49IQJUHH,90,0,"My 2 cents, focus on the rest of the software to get it stable and reliable and if needed, release WiFi later. Adding a feature like that at this point would only delay the delivery.",91525841,A18JA2145UWXG,0,A32QBXDPHHSTOD,0,A3HW4QDJB63OQ2,0,A9K0CV70JWG1W,0,AQR70X1KIOP6B,0,0,2015-06-15 07:46:15 UTC
3YZ7A3YHR5TW8VI8UHV3TWJVSK85SW,792,8,"oh and I just realized I have a Windows 8 computer, it says only compatible with Windows 7 is that correct",856391071,A1PE0077HI218F,0,A1V6P1ZE6Q8YEW,0,A3HW4QDJB63OQ2,0,A9K0CV70JWG1W,0,AQR70X1KIOP6B,0,0,2015-06-15 08:34:51 UTC
37S0QRNUFBGXCTM1EHW1OPTLIG2881,591,18,Hi. I noticed the color selection is for our top three choices. What about backers with two devices How are they going to get two different colors if they wish to indicate so.,632130817,A1PE0077HI218F,0,A1V6P1ZE6Q8YEW,0,A2RD843ESYKRP2,0,A3KOVCQYR8K3HY,0,A9K0CV70JWG1W,0,0,2015-06-15 08:00:58 UTC
3421H3BM9AHMAF1UADZ6DBXAIXF9JC,332,3,"Also your campaign description says that delivery will be in July, as does update 1, but reward descriptions says June. Which is it",349608658,A291KO368YRYCR,0,A3HW4QDJB63OQ2,0,A3KOVCQYR8K3HY,0,A9K0CV70JWG1W,0,AKJ8CNFZH73K6,0,0,2015-06-15 08:53:07 UTC
3BFF0DJK8XCYTXTYVDD1WCP98NUSTA,979,87,Would it work with the BB10 android emulation platform,1056848468,A16U1L4R6WV5G2,0,A1V6P1ZE6Q8YEW,0,A32QBXDPHHSTOD,0,A9K0CV70JWG1W,0,AKJ8CNFZH73K6,0,0,2015-06-15 07:53:37 UTC
35A1YQPVFEG7EHFCP51PPUD8JM6I5H,981,2,Any update,1057435473,A1V6P1ZE6Q8YEW,0,A3KOVCQYR8K3HY,0,A3Q92WMGIHEPSD,0,A9K0CV70JWG1W,0,AXMPSUNKUBEIL,0,0,2015-06-15 07:58:52 UTC
322ZSN9Z5GKFRCRN5CHJY993U7RT44,476,23,Would you be able to charge the Stove Lite Pro in Europe 220V outlet,499323151,A1ZFUBB7KVAT4G,0,A3HW4QDJB63OQ2,0,A9K0CV70JWG1W,0,AKJ8CNFZH73K6,0,AQR70X1KIOP6B,0,0,2015-06-15 07:52:51 UTC
30U1YOGZGAWRC8X19NDMR87N516DSC,521,82,"Public Lab Is it possible to create another pledge, combining the first two pledges, webcam and DIYfilter I believe, that this combination would be very welcome at least for me.",547118344,A1T79J0XQXDDGC,0,A291KO368YRYCR,0,A32QBXDPHHSTOD,0,A3HW4QDJB63OQ2,0,A9K0CV70JWG1W,0,0,2015-06-15 08:09:10 UTC
3UUIU9GZC55XNVVNJH0T31FHU3M5TL,796,84,"Hello, and thanks for your reply. Would it be possible to use the IR controller to be programmed for other uses ie other helicopters or TV for that matter. And also I am sure you saw that, but there is cam equipped heli coming  httpwww.red5.co.ukProductDetail.aspx. Igor",858851265,A1T79J0XQXDDGC,0,A3HW4QDJB63OQ2,0,A9K0CV70JWG1W,0,AKJ8CNFZH73K6,0,AQR70X1KIOP6B,0,0,2015-06-15 08:29:33 UTC
3YZ7A3YHR5TW8VI8UHV3TWJVSK7S5I,988,7,"Update 7, I meant. Alternatively, here is the housing file link httpswww.dropbox.comsd258ksu48fiztf9SmokeSignalHousing.3.15.15.zip",1060904411,A1ZFUBB7KVAT4G,0,A2RD843ESYKRP2,0,A3HW4QDJB63OQ2,0,A3Q92WMGIHEPSD,0,A9K0CV70JWG1W,0,0,2015-06-15 07:56:39 UTC
3XJOUITW8URMGHEL39OW1CA8QZ9QTJ,519,15,"Chris, one Pixate Engine license gives you distribution rights in an UNLIMITED number of your apps. Multiple developers need multiple licenses. Thanks.",546469467,A18JA2145UWXG,0,A32QBXDPHHSTOD,0,A3HW4QDJB63OQ2,0,A9K0CV70JWG1W,0,AQR70X1KIOP6B,0,0,2015-06-15 08:07:21 UTC
